{"approval":{"actor_id":"member-approver-001","approval_id":"approval-synthetic-001","approved_at":"2026-07-20T10:16:00Z","immutable":true,"organization_id":"org-synthetic","project_id":"project-sample-mobile-app-synthetic","state":"approved","ticket_content_digest":"sha256:bdbfb5ffb6153847b5a111d577309a70b3f86c8772ba238db332eca62758fc7f","ticket_id":"ticket-synthetic-001","ticket_version":4},"authority":{"allowed_repositories":["repo-sample-mobile-app","repo-sample-backend"],"deploy":false,"external_writes":false,"merge":false,"modify_code":true,"purpose":"implement_approved_ticket","read_authorized_evidence":true,"run_tests":true},"build_identity":{"backend":{"availability":"available","deployed_at":"2026-07-20T09:55:00Z","deployment_id":"deploy-synthetic-042","environment":"synthetic-qa","image_digest":"sha256:2222222222222222222222222222222222222222222222222222222222222222","sources":[{"dirty":false,"repository_id":"repo-sample-backend","revision":"89abcdef0123456789abcdef0123456789abcdef"}],"unavailable_reason":null},"build_id":"build-ios-synthetic-031","build_identity_digest":"sha256:f64af91f8587624ef1f7be29e7651a44b82e86f922ee4bc15c3105f9d467550b","contract_version":"tacua.build-identity@1.0.0","media_type":"application/vnd.tacua.build-identity+json;version=1.0.0","mobile":{"app_version":"1.7.0","application_id":"com.example.samplemobileapp.tacua.synthetic","build_number":"31","distribution":"testflight","native_binary_digest":"sha256:1111111111111111111111111111111111111111111111111111111111111111","platform":"ios","source":{"dirty":false,"repository_id":"repo-sample-mobile-app","revision":"0123456789abcdef0123456789abcdef01234567"}},"organization_id":"org-synthetic","project_id":"project-sample-mobile-app-synthetic","sdk":{"capture_schema_version":"tacua.sdk-evidence@1.0.0","configuration_digest":"sha256:3333333333333333333333333333333333333333333333333333333333333333","package_name":"@tacua/mobile-sdk","package_version":"0.1.0","source_revision":"fedcba9876543210fedcba9876543210fedcba98"}},"contract_version":"tacua.approved-handoff@1.1.0","evidence_manifest":{"contract_version":"tacua.evidence-manifest@1.0.0","evidence_manifest_digest":"sha256:43483eaf0a5a55a120c9cfee704ebfbafd3db95dd89d8e6ff5ff8ca320d38f0f","items":[{"authorization":{"actor_id":"member-approver-001","approved_at":"2026-07-20T10:15:00Z","authorized_for_handoff":true,"decision_id":"decision-route-001","evidence_id":"evidence-route-001","immutable":true,"organization_id":"org-synthetic","policy_version":"tacua.egress@1.0.0","project_id":"project-sample-mobile-app-synthetic"},"availability":"available","contract_version":"tacua.evidence-item@1.0.0","description":"SDK route transition into the profile editor.","evidence_id":"evidence-route-001","evidence_item_digest":"sha256:e6b5eba909829a62c973a0e32d9f1a56340eeb2a5281bce40ee3dde1e31d3680","evidence_type":"sdk.route_transition","organization_id":"org-synthetic","project_id":"project-sample-mobile-app-synthetic","reference":{"content_digest":"sha256:4444444444444444444444444444444444444444444444444444444444444444","content_type":"application/vnd.tacua.sdk-event+json","locator":{"evidence_id":"evidence-route-001","organization_id":"org-synthetic","project_id":"project-sample-mobile-app-synthetic","revision_id":"revision-route-001","scheme":"tacua-evidence"},"size_bytes":912},"session_id":"session-synthetic-001","source":{"captured_at":"2026-07-20T10:00:01Z","component":"mobile_sdk","snapshot_revision":"sdk-event-0007","source_id":"sdk-session-001"},"time_range":{"clock":"session_monotonic","end_ms":1260,"start_ms":1200},"unavailable":null},{"authorization":{"actor_id":"member-approver-001","approved_at":"2026-07-20T10:15:00Z","authorized_for_handoff":true,"decision_id":"decision-keyframe-001","evidence_id":"evidence-keyframe-001","immutable":true,"organization_id":"org-synthetic","policy_version":"tacua.egress@1.0.0","project_id":"project-sample-mobile-app-synthetic"},"availability":"available","contract_version":"tacua.evidence-item@1.0.0","description":"Authorized keyframe showing the incorrect button label; pixels remain reference-only.","evidence_id":"evidence-keyframe-001","evidence_item_digest":"sha256:f4e4427f4ef61ed33700b9f5874be68e5df6452f42e585ff719fffe5fc5be843","evidence_type":"media.keyframe","organization_id":"org-synthetic","project_id":"project-sample-mobile-app-synthetic","reference":{"content_digest":"sha256:5555555555555555555555555555555555555555555555555555555555555555","content_type":"image/png","locator":{"evidence_id":"evidence-keyframe-001","organization_id":"org-synthetic","project_id":"project-sample-mobile-app-synthetic","revision_id":"revision-keyframe-001","scheme":"tacua-evidence"},"size_bytes":48123},"session_id":"session-synthetic-001","source":{"captured_at":"2026-07-20T10:00:04Z","component":"mobile_sdk","snapshot_revision":"keyframe-001","source_id":"sdk-session-001"},"time_range":{"clock":"session_monotonic","end_ms":3900,"start_ms":3900},"unavailable":null},{"authorization":{"actor_id":"member-approver-001","approved_at":"2026-07-20T10:15:00Z","authorized_for_handoff":true,"decision_id":"decision-tap-001","evidence_id":"evidence-tap-001","immutable":true,"organization_id":"org-synthetic","policy_version":"tacua.egress@1.0.0","project_id":"project-sample-mobile-app-synthetic"},"availability":"available","contract_version":"tacua.evidence-item@1.0.0","description":"SDK metadata for the first enabled save-button interaction.","evidence_id":"evidence-tap-001","evidence_item_digest":"sha256:56991e60d9660e2be5fc340bfba1f4f5b81c75fd6a19e938f2a4785cfc9ce55e","evidence_type":"sdk.user_interaction","organization_id":"org-synthetic","project_id":"project-sample-mobile-app-synthetic","reference":{"content_digest":"sha256:6666666666666666666666666666666666666666666666666666666666666666","content_type":"application/vnd.tacua.sdk-event+json","locator":{"evidence_id":"evidence-tap-001","organization_id":"org-synthetic","project_id":"project-sample-mobile-app-synthetic","revision_id":"revision-tap-001","scheme":"tacua-evidence"},"size_bytes":608},"session_id":"session-synthetic-001","source":{"captured_at":"2026-07-20T10:00:04Z","component":"mobile_sdk","snapshot_revision":"sdk-event-0012","source_id":"sdk-session-001"},"time_range":{"clock":"session_monotonic","end_ms":4240,"start_ms":4200},"unavailable":null},{"authorization":{"actor_id":"member-approver-001","approved_at":"2026-07-20T10:15:00Z","authorized_for_handoff":true,"decision_id":"decision-repository-001","evidence_id":"evidence-repository-001","immutable":true,"organization_id":"org-synthetic","policy_version":"tacua.egress@1.0.0","project_id":"project-sample-mobile-app-synthetic"},"availability":"available","contract_version":"tacua.evidence-item@1.0.0","description":"Commit-scoped, read-only repository search snapshot for the profile-form label.","evidence_id":"evidence-repository-001","evidence_item_digest":"sha256:147956c3559a97a6b6dba078b41bb06e85cd4d917b0fe8ce2733c2df4709f231","evidence_type":"repository.commit_snapshot","organization_id":"org-synthetic","project_id":"project-sample-mobile-app-synthetic","reference":{"content_digest":"sha256:7777777777777777777777777777777777777777777777777777777777777777","content_type":"application/vnd.tacua.connector-snapshot+json","locator":{"evidence_id":"evidence-repository-001","organization_id":"org-synthetic","project_id":"project-sample-mobile-app-synthetic","revision_id":"revision-repository-001","scheme":"tacua-evidence"},"size_bytes":2048},"session_id":"session-synthetic-001","source":{"captured_at":"2026-07-20T10:07:00Z","component":"repository","snapshot_revision":"0123456789abcdef0123456789abcdef01234567","source_id":"repo-sample-mobile-app"},"time_range":null,"unavailable":null},{"authorization":{"actor_id":"member-approver-001","approved_at":"2026-07-20T10:15:00Z","authorized_for_handoff":true,"decision_id":"decision-backend-001","evidence_id":"evidence-backend-001","immutable":true,"organization_id":"org-synthetic","policy_version":"tacua.egress@1.0.0","project_id":"project-sample-mobile-app-synthetic"},"availability":"available","contract_version":"tacua.evidence-item@1.0.0","description":"Immutable backend deployment and request-count snapshot for the session window.","evidence_id":"evidence-backend-001","evidence_item_digest":"sha256:b703d8bcc07247e8f3c98ae64a0a04b344538b934e210d4c579def4a45ae285b","evidence_type":"backend.deployment_snapshot","organization_id":"org-synthetic","project_id":"project-sample-mobile-app-synthetic","reference":{"content_digest":"sha256:8888888888888888888888888888888888888888888888888888888888888888","content_type":"application/vnd.tacua.connector-snapshot+json","locator":{"evidence_id":"evidence-backend-001","organization_id":"org-synthetic","project_id":"project-sample-mobile-app-synthetic","revision_id":"revision-backend-001","scheme":"tacua-evidence"},"size_bytes":1344},"session_id":"session-synthetic-001","source":{"captured_at":"2026-07-20T10:08:00Z","component":"backend","snapshot_revision":"backend-snapshot-001","source_id":"deploy-synthetic-042"},"time_range":{"clock":"session_monotonic","end_ms":9000,"start_ms":4000},"unavailable":null},{"authorization":null,"availability":"unavailable","contract_version":"tacua.evidence-item@1.0.0","description":"Sentry correlation status for this synthetic session.","evidence_id":"evidence-sentry-001","evidence_item_digest":"sha256:c120f94f1ccdf7ea5aad97205d9fc5abc2cb9d8a30f39a8eff0ddd5a4b78042b","evidence_type":"observability.sentry_snapshot","organization_id":"org-synthetic","project_id":"project-sample-mobile-app-synthetic","reference":null,"session_id":"session-synthetic-001","source":{"captured_at":"2026-07-20T10:09:00Z","component":"sentry","snapshot_revision":"unavailable-001","source_id":"sentry-project-synthetic"},"time_range":{"clock":"session_monotonic","end_ms":9000,"start_ms":0},"unavailable":{"detail":"The synthetic connector was revoked before the bounded r